{"version": "v1", "nc": 6, "names": ["center", "scratch", "donut", "random", "edge-loc", "edge-ring"], "cluster_stats": {"k": 6, "silhouette": 0.4208, "silhouette_by_k": {"3": 0.3791, "4": 0.3881, "5": 0.3976, "6": 0.4208}, "clusters": [{"cluster_id": 0, "size": 11, "support": 12, "descriptor_mean": {"ring_ness": 1.9256, "center_ness": 0.7712, "elongation": 9.8938, "edge_frac": 0.0, "n_components": 1.0909, "defect_ratio": 0.0153, "radial_hist": [0.2757, 0.3663, 0.1848, 0.1166, 0.0479, 0.0086, 0.0, 0.0]}, "excluded": false}, {"cluster_id": 1, "size": 27, "support": 29, "descriptor_mean": {"ring_ness": 3.3134, "center_ness": 0.6162, "elongation": 10.7978, "edge_frac": 0.0335, "n_components": 1.0741, "defect_ratio": 0.0157, "radial_hist": [0.0132, 0.2254, 0.3195, 0.2075, 0.1256, 0.0753, 0.029, 0.0045]}, "excluded": false}, {"cluster_id": 2, "size": 19, "support": 19, "descriptor_mean": {"ring_ness": 15.921, "center_ness": 0.5701, "elongation": 1.0067, "edge_frac": 0.0, "n_components": 1.0, "defect_ratio": 0.0729, "radial_hist": [0.0, 0.0, 0.2237, 0.6406, 0.1356, 0.0, 0.0, 0.0]}, "excluded": false}, {"cluster_id": 3, "size": 18, "support": 50, "descriptor_mean": {"ring_ness": 2.8051, "center_ness": 0.5565, "elongation": 3.2376, "edge_frac": 0.0328, "n_components": 2.7778, "defect_ratio": 0.0359, "radial_hist": [0.0209, 0.1641, 0.2324, 0.1539, 0.2221, 0.1738, 0.0327, 0.0001]}, "excluded": false}, {"cluster_id": 4, "size": 15, "support": 15, "descriptor_mean": {"ring_ness": 18.1118, "center_ness": 0.4434, "elongation": 1.0101, "edge_frac": 0.0, "n_components": 1.0, "defect_ratio": 0.0782, "radial_hist": [0.0, 0.0, 0.0, 0.1106, 0.8142, 0.0751, 0.0, 0.0]}, "excluded": false}, {"cluster_id": 5, "size": 30, "support": 30, "descriptor_mean": {"ring_ness": 20.0, "center_ness": 0.1209, "elongation": 4.287, "edge_frac": 1.0, "n_components": 1.0, "defect_ratio": 0.0474, "radial_hist": [0.0, 0.0, 0.0, 0.0, 0.0, 0.0, 0.4617, 0.5383]}, "excluded": false}]}, "naming_rationale": [{"cluster_id": 0, "name": "center", "rationale": "center_ness=0.77 全群最高，radial_hist 前兩個 bin 就佔 0.276+0.366=0.642，缺陷幾乎都落在晶圓中心區域，montage 圖上的短斜線也集中在圓心附近", "evidence": "01-raw-data/datasets/ds36/montage_c0.png"}, {"cluster_id": 1, "name": "scratch", "rationale": "elongation=10.80 為六群最高，radial_hist 從 bin1 延伸到 bin5（而非集中在 bin0/1），配合 montage 圖上明顯的細長對角線條，符合刮痕的細長延展特徵", "evidence": "01-raw-data/datasets/ds36/montage_c1.png"}, {"cluster_id": 2, "name": "donut", "rationale": "ring_ness=15.92 高、elongation=1.01 近乎等軸對稱，radial_hist 集中在 bin3（0.641），montage 圖為半徑中段的完整封閉環，符合中間半徑閉合環的定義", "evidence": "01-raw-data/datasets/ds36/montage_c2.png"}, {"cluster_id": 3, "name": "random", "rationale": "n_components=2.78 為六群最高（缺陷分裂成多個團塊）、ring_ness=2.81 為六群最低，radial_hist 在 bin1~bin5 之間分佈平緩無單一峰值，montage 圖顯示零散團塊無固定型態", "evidence": "01-raw-data/datasets/ds36/montage_c3.png"}, {"cluster_id": 4, "name": "edge-loc", "rationale": "center_ness=0.44 低於 donut 群、radial_hist 峰值落在更外側的 bin4（0.814，比 c2 的 bin3 更靠外），環位置比 donut 更偏外側但 edge_frac 仍為 0.00 未達真正邊緣，是介於 donut 與邊緣之間的局部環狀團塊", "evidence": "01-raw-data/datasets/ds36/montage_c4.png"}, {"cluster_id": 5, "name": "edge-ring", "rationale": "edge_frac=1.00 與 ring_ness=20.00 皆為六群最高，radial_hist 全數落在 bin6/bin7（0.462+0.538=1.0）代表緊貼外緣，elongation=4.29 明顯高於 c2/c4 的 1.01，顯示 montage 圖上是沿外緣的開放弧形而非完整環", "evidence": "01-raw-data/datasets/ds36/montage_c5.png"}], "montage_urls": ["01-raw-data/datasets/ds36/montage_c0.png", "01-raw-data/datasets/ds36/montage_c1.png", "01-raw-data/datasets/ds36/montage_c2.png", "01-raw-data/datasets/ds36/montage_c3.png", "01-raw-data/datasets/ds36/montage_c4.png", "01-raw-data/datasets/ds36/montage_c5.png"]}