{"version": "v1", "nc": 6, "names": ["scratch", "center", "donut", "edge-ring", "edge-loc", "random"], "cluster_stats": {"k": 6, "silhouette": 0.4208, "silhouette_by_k": {"3": 0.3791, "4": 0.3881, "5": 0.3976, "6": 0.4208}, "clusters": [{"cluster_id": 0, "size": 11, "support": 12, "descriptor_mean": {"ring_ness": 1.9256, "center_ness": 0.7712, "elongation": 9.8938, "edge_frac": 0.0, "n_components": 1.0909, "defect_ratio": 0.0153, "radial_hist": [0.2757, 0.3663, 0.1848, 0.1166, 0.0479, 0.0086, 0.0, 0.0]}, "excluded": false}, {"cluster_id": 1, "size": 27, "support": 29, "descriptor_mean": {"ring_ness": 3.3134, "center_ness": 0.6162, "elongation": 10.7978, "edge_frac": 0.0335, "n_components": 1.0741, "defect_ratio": 0.0157, "radial_hist": [0.0132, 0.2254, 0.3195, 0.2075, 0.1256, 0.0753, 0.029, 0.0045]}, "excluded": false}, {"cluster_id": 2, "size": 19, "support": 19, "descriptor_mean": {"ring_ness": 15.921, "center_ness": 0.5701, "elongation": 1.0067, "edge_frac": 0.0, "n_components": 1.0, "defect_ratio": 0.0729, "radial_hist": [0.0, 0.0, 0.2237, 0.6406, 0.1356, 0.0, 0.0, 0.0]}, "excluded": false}, {"cluster_id": 3, "size": 18, "support": 50, "descriptor_mean": {"ring_ness": 2.8051, "center_ness": 0.5565, "elongation": 3.2376, "edge_frac": 0.0328, "n_components": 2.7778, "defect_ratio": 0.0359, "radial_hist": [0.0209, 0.1641, 0.2324, 0.1539, 0.2221, 0.1738, 0.0327, 0.0001]}, "excluded": false}, {"cluster_id": 4, "size": 15, "support": 15, "descriptor_mean": {"ring_ness": 18.1118, "center_ness": 0.4434, "elongation": 1.0101, "edge_frac": 0.0, "n_components": 1.0, "defect_ratio": 0.0782, "radial_hist": [0.0, 0.0, 0.0, 0.1106, 0.8142, 0.0751, 0.0, 0.0]}, "excluded": false}, {"cluster_id": 5, "size": 30, "support": 30, "descriptor_mean": {"ring_ness": 20.0, "center_ness": 0.1209, "elongation": 4.287, "edge_frac": 1.0, "n_components": 1.0, "defect_ratio": 0.0474, "radial_hist": [0.0, 0.0, 0.0, 0.0, 0.0, 0.0, 0.4617, 0.5383]}, "excluded": false}]}, "naming_rationale": [{"cluster_id": 0, "name": "scratch", "rationale": "[fallback 機械命名] ring_ness 1.93、edge_frac 0.00、elongation 9.89 → scratch", "evidence": "01-raw-data/datasets/ds154/montage_c0.png"}, {"cluster_id": 1, "name": "center", "rationale": "[fallback 機械命名] ring_ness 3.31、edge_frac 0.03、elongation 10.80 → center（首選 scratch 已被前一群用掉，退到 center）", "evidence": "01-raw-data/datasets/ds154/montage_c1.png"}, {"cluster_id": 2, "name": "donut", "rationale": "[fallback 機械命名] ring_ness 15.92、edge_frac 0.00、elongation 1.01 → donut", "evidence": "01-raw-data/datasets/ds154/montage_c2.png"}, {"cluster_id": 3, "name": "edge-ring", "rationale": "[fallback 機械命名] ring_ness 2.81、edge_frac 0.03、elongation 3.24 → edge-ring（首選 scratch 已被前一群用掉，退到 edge-ring）", "evidence": "01-raw-data/datasets/ds154/montage_c3.png"}, {"cluster_id": 4, "name": "edge-loc", "rationale": "[fallback 機械命名] ring_ness 18.11、edge_frac 0.00、elongation 1.01 → edge-loc（首選 donut 已被前一群用掉，退到 edge-loc）", "evidence": "01-raw-data/datasets/ds154/montage_c4.png"}, {"cluster_id": 5, "name": "random", "rationale": "[fallback 機械命名] ring_ness 20.00、edge_frac 1.00、elongation 4.29 → random（首選 edge-ring 已被前一群用掉，退到 random）", "evidence": "01-raw-data/datasets/ds154/montage_c5.png"}], "montage_urls": ["01-raw-data/datasets/ds154/montage_c0.png", "01-raw-data/datasets/ds154/montage_c1.png", "01-raw-data/datasets/ds154/montage_c2.png", "01-raw-data/datasets/ds154/montage_c3.png", "01-raw-data/datasets/ds154/montage_c4.png", "01-raw-data/datasets/ds154/montage_c5.png"]}